{"authentication_method":"symphony.ssiag.local-peer","classification":"administrative_metadata","contracts":[{"configuration_state":"digests","event_class":"symphony.sav.named-version.lifecycle","intent_id":"symphony.sav.named-version.alias","operation_id":"symphony.sav.named-version.alias","outcomes":[{"outcome":"failed","reason_code":"symphony.sav.named-version.alias.failed"},{"outcome":"succeeded","reason_code":"symphony.sav.named-version.alias.succeeded"},{"outcome":"unavailable","reason_code":"symphony.sav.named-version.alias.unavailable"}],"target_kind":"symphony.sav.named-version-registry"},{"configuration_state":"digests","event_class":"symphony.sav.named-version.lifecycle","intent_id":"symphony.sav.named-version.prepare","operation_id":"symphony.sav.named-version.prepare","outcomes":[{"outcome":"failed","reason_code":"symphony.sav.named-version.prepare.failed"},{"outcome":"succeeded","reason_code":"symphony.sav.named-version.prepare.succeeded"},{"outcome":"unavailable","reason_code":"symphony.sav.named-version.prepare.unavailable"}],"target_kind":"symphony.sav.named-version-proposal"},{"configuration_state":"digests","event_class":"symphony.sav.named-version.lifecycle","intent_id":"symphony.sav.named-version.recover","operation_id":"symphony.sav.named-version.recover","outcomes":[{"outcome":"failed","reason_code":"symphony.sav.named-version.recover.failed"},{"outcome":"succeeded","reason_code":"symphony.sav.named-version.recover.succeeded"},{"outcome":"unavailable","reason_code":"symphony.sav.named-version.recover.unavailable"}],"target_kind":"symphony.sav.named-version-registry"},{"configuration_state":"digests","event_class":"symphony.sav.named-version.lifecycle","intent_id":"symphony.sav.named-version.seal","operation_id":"symphony.sav.named-version.seal","outcomes":[{"outcome":"failed","reason_code":"symphony.sav.named-version.seal.failed"},{"outcome":"succeeded","reason_code":"symphony.sav.named-version.seal.succeeded"},{"outcome":"unavailable","reason_code":"symphony.sav.named-version.seal.unavailable"}],"target_kind":"symphony.sav.named-version"}],"integration_id":"symphony.accordare.audit","producer_grant_authorized":false,"producer_kind":"symphony.stav.producer","protocol":"symphony.stav.producer-vocabulary.v1","runtime_producer_implemented":false}
